"tweet_id","in_reply_to_status_id","in_reply_to_user_id","retweeted_status_id","retweeted_status_user_id","timestamp","source","text","expanded_urls"
"9258728357","9226683390","821193","","","2010-02-18 00:20:17 +0000","web","@slashfilm My girlfriend gave me an autographed bottle of Billy Mitchell's hot sauce for Valentine's Day"
"8880197765","","","","","2010-02-10 01:14:56 +0000","<a href=""http://itunes.apple.com/app/twitter/id333903271?mt=8"" rel=""nofollow"">Twitter for iPhone</a>","Favorite song of 2009? Picking ""1901"" (http://bit.ly/blbu7o) feels like a cop out, but I think I have to do it anyway #fb"
"8789364443","","","","","2010-02-08 01:32:59 +0000","<a href=""http://www.tweetdeck.com/"" rel=""nofollow"">TweetDeck</a>","And Volkswagen uses Grizzly Bear. The music this year is better than the commercials themselves #fb"
"8788078225","","","","","2010-02-08 01:02:25 +0000","<a href=""http://www.tweetdeck.com/"" rel=""nofollow"">TweetDeck</a>","Loving the use of Arcade Fire's ""Wake Up"" in all these NFL commercials #fb"
"8731415356","","","","","2010-02-06 18:28:38 +0000","<a href=""http://itunes.apple.com/app/twitter/id333903271?mt=8"" rel=""nofollow"">Twitter for iPhone</a>","RT @keithlaw Make good music. RT @mental_floss Chili Peppers. Is there anything they can't do? -- http://bit.ly/dhBBBq"
"8664054763","","","","","2010-02-05 04:44:55 +0000","<a href=""http://www.tweetdeck.com/"" rel=""nofollow"">TweetDeck</a>","Cloudy with a Chance of Meatballs = favorite animated film of 2009, but made me really hungry."
"8572663987","","15146558","","","2010-02-03 03:39:28 +0000","<a href=""http://itunes.apple.com/app/twitter/id333903271?mt=8"" rel=""nofollow"">Twitter for iPhone</a>","@keithlaw Have you read DFW's Infinite Jest? If not, do you ever plan to?"
