"tweet_id","in_reply_to_status_id","in_reply_to_user_id","retweeted_status_id","retweeted_status_user_id","timestamp","source","text","expanded_urls"
"119827418709102592","","","119803701480263680","9279652","2011-09-30 17:34:17 +0000","<a href=""http://twitter.com/download/iphone"" rel=""nofollow"">Twitter for iPhone</a>","RT @NewYorkology: True/not, this means crowds: Rumor that Radiohead will play for Wall St protestors 4pm today - @brooklynvegan/@gawker  ..."
"119800005031763969","","","","","2011-09-30 15:45:21 +0000","<a href=""http://twitter.com/download/iphone"" rel=""nofollow"">Twitter for iPhone</a>","Jealous that Thursday's crowd got to hear ""Like Spinning Plates."" Really can't complain about getting ""Street Spirit"" on Wednesday though."
"119551914315747328","","","","","2011-09-29 23:19:32 +0000","<a href=""http://foursquare.com"" rel=""nofollow"">foursquare</a>","I'm at Austin Bergstrom International Airport (AUS) (3600 Presidential Blvd., Texas Hwy. 71, Austin) w/ 36 others http://t.co/6KU1aBTd","http://4sq.com/o1lHuh"
"119184237625745408","","","","","2011-09-28 22:58:31 +0000","<a href=""http://foursquare.com"" rel=""nofollow"">foursquare</a>","I'm at Roseland Ballroom for Radiohead (239 W 52nd St, btw Broadway & 8th, New York) w/ 51 others http://t.co/50gDGQH6","http://4sq.com/qMfapP"
"118832082268073984","","","","","2011-09-27 23:39:10 +0000","<a href=""http://twitter.com/download/iphone"" rel=""nofollow"">Twitter for iPhone</a>","New Primus is fantastic: http://t.co/pXFDP7fL","http://mog.com/tracks/mn57757725"
"118516676387020801","","15289800","","","2011-09-27 02:45:52 +0000","<a href=""http://itunes.apple.com/us/app/twitter/id409789998?mt=12"" rel=""nofollow"">Twitter for Mac</a>","@mogdotcom really needs @turntablefm integration..."
"118469438881267712","","","","","2011-09-26 23:38:09 +0000","<a href=""http://twitter.com/tweetbutton"" rel=""nofollow"">Tweet Button</a>","Was not expecting the Lou Reed/Metallica collaboration to be quite this awesome: http://t.co/MxPpITGw","http://pitchfork.com/news/44107-listen-to-a-full-track-from-the-lou-reed-and-metallica-collaboration-the-view/"
"118327617899331584","","","","","2011-09-26 14:14:37 +0000","<a href=""http://twitter.com/download/iphone"" rel=""nofollow"">Twitter for iPhone</a>","Somehow just got tickets to see Radiohead on Wednesday... #fb"
"117739463853084672","","","","","2011-09-24 23:17:30 +0000","<a href=""http://foursquare.com"" rel=""nofollow"">foursquare</a>","I'm at Sutton Place (124 W Park Ave, National Blvd., Long Beach) http://t.co/vYNlmgeJ","http://4sq.com/noGZyH"
"116700110309695488","","","","","2011-09-22 02:27:29 +0000","<a href=""http://itunes.apple.com/us/app/twitter/id409789998?mt=12"" rel=""nofollow"">Twitter for Mac</a>","Found my favorite album of the year: Neon Indian's ""Era Extra?a"" #fb"
"116686965063163904","","","","","2011-09-22 01:35:15 +0000","<a href=""http://itunes.apple.com/us/app/twitter/id409789998?mt=12"" rel=""nofollow"">Twitter for Mac</a>","DJ Shadow's ""Endtroducing"" is phenomenal. How am I only learning about this now?"
"116685643052097537","","","","","2011-09-22 01:29:59 +0000","<a href=""http://itunes.apple.com/us/app/twitter/id409789998?mt=12"" rel=""nofollow"">Twitter for Mac</a>","Hoping that Facebook Music allows me to finally stop using Last.fm (for gathering listening statistics) once and for all."
"115890083143499776","","","115867821161971712","14740219","2011-09-19 20:48:43 +0000","<a href=""http://twitter.com/download/iphone"" rel=""nofollow"">Twitter for iPhone</a>","RT @amazonmp3: FYI, we have a bunch of @radiohead albums priced from $5.99 for a limited time: http://t.co/D0PhrTBL","http://amzn.to/qoCDjM"
"115417730714320897","","","115412293512208384","14740219","2011-09-18 13:31:46 +0000","<a href=""http://twitter.com/download/iphone"" rel=""nofollow"">Twitter for iPhone</a>","RT @amazonmp3: Today's Daily Deal: @wilco's landmark album Yankee Hotel Foxtrot. $3.99: http://t.co/tEVyoDLD #jesusetcisareallygoodsong","http://amzn.to/pJrdhS"
"114722431184285697","114716779443527680","15025802","","","2011-09-16 15:28:53 +0000","<a href=""http://twitter.com/download/iphone"" rel=""nofollow"">Twitter for iPhone</a>","@matthewcerrone Try Instapaper!"
"114161731961499649","","","","","2011-09-15 02:20:52 +0000","<a href=""http://itunes.apple.com/us/app/twitter/id409789998?mt=12"" rel=""nofollow"">Twitter for Mac</a>","JavaScript: The Good Parts"
"114082545087430657","","79033767","","","2011-09-14 21:06:12 +0000","<a href=""http://twitter.com/download/iphone"" rel=""nofollow"">Twitter for iPhone</a>","@reederapp Any chance the little temporary ""Starred/Unstarred/Read/Unread"" alerts in the iOS clients are open source?"
"112322588914614273","","","","","2011-09-10 00:32:46 +0000","<a href=""http://foursquare.com"" rel=""nofollow"">foursquare</a>","I'm at The Lot on Tap (10th Ave., at 30th St., New York) w/ 14 others http://t.co/2aLbZV1","http://4sq.com/q8ELjW"
"112299688618766338","","","112202467743240192","18007633","2011-09-09 23:01:46 +0000","<a href=""http://twitter.com/download/iphone"" rel=""nofollow"">Twitter for iPhone</a>","RT @jaredpar: ""The best thing about UDP jokes is that I don?t care if you get them or not."""
"111610763159932928","","","111608470364631040","14740219","2011-09-08 01:24:14 +0000","<a href=""http://itunes.apple.com/us/app/twitter/id409789998?mt=12"" rel=""nofollow"">Twitter for Mac</a>","RT @amazonmp3: We have a whole mess o' @wilco albums for $5 each through the end of the month: http://t.co/7baoQrI","http://amzn.to/rlop8y"
"110026558852448256","","","","","2011-09-03 16:29:10 +0000","<a href=""http://foursquare.com"" rel=""nofollow"">foursquare</a>","I'm at Alumni Stadium for Northwestern Wildcats vs. Boston College Eagles w/ @thedooner64 http://t.co/FTaSVe8","http://4sq.com/njpB1O"
"109988168618606592","","","","","2011-09-03 13:56:37 +0000","<a href=""http://foursquare.com"" rel=""nofollow"">foursquare</a>","I'm at Boston College (Boston College, 140 Commonwealth Avenue, Boston) w/ 12 others http://t.co/wby5CqW","http://4sq.com/ommhoW"
